{
  "item": [
    {
      "type": "single",
      "question": "材料：健全河湖长制、林长制，强化生态环境行政执法与刑事司法衔接。据此分析，保证生态环境保护制度执行力的关键是",
      "options": [
        "制度制定后任其自然执行即可",
        "压实具体责任主体（河湖长、林长），强化行刑衔接严处破坏生态违法犯罪，树立制度刚性与权威、释放严加惩处信号",
        "只靠宣传教育引导，无需刚性约束",
        "减少执法监管力度以降低生态保护成本"
      ]
    }
  ],
  "requirement": [
    "答案：B",
    "依靠压实具体责任主体（河湖长、林长）",
    "强化行政执法与刑事司法衔接，严处破坏生态违法犯罪",
    "树立制度刚性与权威，释放严加惩处的信号"
  ],
  "revision": 2,
  "schema_version": "1.0",
  "status": "draft",
  "test_id": "test_1354",
  "title": "单选题",
  "updated_at": "2026-08-15T16:18:49Z"
}
