{
  "item": [
    {
      "type": "single",
      "question": "关于'国家一切权力属于人民'在制度层面的体现，下列说法正确的是",
      "options": [
        "我国国体是人民民主专政的社会主义国家，人民是国家权力的主体",
        "人民只能通过间接方式参与国家和社会事务管理，不能直接参与",
        "国家机关的权力来自宪法授权，与人民关系不大",
        "国家权力应集中在少数人手中，以保证效率"
      ]
    }
  ],
  "requirement": [
    "答案：A",
    "我国国体是人民民主专政的社会主义国家，国家一切权力属于人民",
    "人民通过人民代表大会行使国家权力，并通过多种途径形式管理国家、经济文化和社会事业",
    "体现人民当家作主的国体与政体统一"
  ],
  "revision": 2,
  "schema_version": "1.0",
  "status": "draft",
  "test_id": "test_1132",
  "title": "单选题",
  "updated_at": "2026-08-15T16:18:49Z"
}
