{
  "item": [
    {
      "type": "single",
      "question": "关于文化软实力的内涵及我国提高文化软实力的根本所在，下列说法正确的是",
      "options": [
        "文化软实力由约瑟夫·奈提出，指依靠军事和经济强制手段迫使他人认同的能力",
        "提高文化软实力只是进一步提升文化产业产值的过程，与价值观念无关",
        "文化软实力是指通过文化吸引力、价值观感召等非强制手段影响他人的能力；我国提高文化软实力的根本在于坚定文化自信，把文化自信作为更基本、更深沉、更持久的力量",
        "提高文化软实力的根本在于不断扩大影视作品的数量规模"
      ]
    }
  ],
  "requirement": [
    "答案：C",
    "文化软实力由美国学者约瑟夫·奈提出，指通过文化吸引力、价值观感召力等非强制手段产生认同与影响的能力",
    "我国将提高文化软实力上升为国家战略（党的十七大报告首次提出），是综合国力的重要组成部分、民族复兴的精神支撑",
    "根本在于坚定文化自信，把文化自信作为更基本、更深沉、更持久的力量"
  ],
  "revision": 2,
  "schema_version": "1.0",
  "status": "draft",
  "test_id": "test_1683",
  "title": "单选题",
  "updated_at": "2026-08-15T16:18:49Z"
}
