{
  "item": [
    {
      "type": "judge",
      "question": "判断下列说法是否正确：马克思主义与中华优秀传统文化是根本对立的，二者无法结合。",
      "options": []
    }
  ],
  "requirement": [
    "答案：错误",
    "马克思主义与中华优秀传统文化具有高度的契合性",
    "二者相互成就，马克思主义中国化使中华优秀传统文化获得新的生命，中华优秀传统文化为马克思主义提供文化根基",
    "二者结合共同夯实了中国道路的历史基础和群众基础"
  ],
  "revision": 2,
  "schema_version": "1.0",
  "status": "draft",
  "test_id": "test_781",
  "title": "判断题",
  "updated_at": "2026-08-15T16:18:49Z"
}
