{
  "item": [
    {
      "type": "single",
      "question": "某基层干部反映『新事物学不会、老经验不顶用』，为克服『本领恐慌』，他应采取的正确做法是",
      "options": [
        "既然老经验不顶用，干脆放弃学习、凭感觉办事",
        "坚持干什么学什么、缺什么补什么，向书本学、向实践学、向群众学，并把学习同研究解决实际问题结合起来",
        "只钻研新理论，不再向群众和实践请教",
        "把学习成果束之高阁，仅以学习形式应付检查"
      ]
    }
  ],
  "requirement": [
    "答案：B",
    "『老经验不顶用、新事物学不会』折射出本领恐慌，需通过学习补齐短板",
    "坚持干什么学什么、缺什么补什么，向书本学、向实践学、向群众学",
    "把学习同研究解决实际问题结合起来，反对形式主义学风"
  ],
  "revision": 2,
  "schema_version": "1.0",
  "status": "draft",
  "test_id": "test_1655",
  "title": "单选题",
  "updated_at": "2026-08-15T16:18:49Z"
}
