{
  "schema_version": "1.0",
  "revision": 1,
  "status": "published",
  "updated_at": "2026-08-11T00:00:00Z",
  "test_id": "test_922",
  "title": "辨析判断：党的全面领导制度=包办一切管理一切",
  "item": [
    {
      "type": "judge",
      "question": "有人主张：『健全党的全面领导制度，就是让党组织直接管理各类组织和事务的具体运作，包办替代一切。』请判断该说法是否正确并说明理由。",
      "options": []
    }
  ],
  "requirement": [
    "指出该说法错误——党的领导是领导核心作用而非包办替代给基础分",
    "说明党的领导方式是加强政治领导、组织保障、思想引领给分",
    "说明目标是让各组织各就其位、各司其职、各尽其责、有序协同给分",
    "说明各部门既发挥积极性又不能自行其是、各自为政，统一领导与分工协作相统一给分"
  ]
}
