{
  "item": [
    {
      "type": "single",
      "question": "关于用党史事例论证『人民是真正的英雄』，下列说法正确的是",
      "options": [
        "淮海战役的胜利是人民群众用小车推出来的，说明人民是历史创造和胜利的根本依靠",
        "只要依靠少数英雄将领就能夺取革命战争的胜利",
        "人民在革命中只是提供后勤支持，对战争胜负不起决定作用",
        "党的成就是党独立奋斗的结果，与人民的支持关系不大"
      ]
    }
  ],
  "requirement": [
    "答案：A",
    "淮海战役中支前群众推着独轮小车支援前线，是人民群众创造历史、支撑战争胜利的生动例证",
    "它体现了人民群众作为物质财富或社会变革创造者的决定性作用",
    "人民的力量是党的事业胜利的根本依靠",
    "呼应『一切成就归功于人民』的历史唯物主义观点"
  ],
  "revision": 2,
  "schema_version": "1.0",
  "status": "draft",
  "test_id": "test_927",
  "title": "单选题",
  "updated_at": "2026-08-15T16:18:49Z"
}
