{
  "item": [
    {
      "type": "single",
      "question": "关于确立全面深化改革总目标的意义，下列说法正确的是",
      "options": [
        "它标志对社会主义建设规律和改革开放规律认识的深化，为统筹推进各领域改革提供'管总'目标，对现代化建设和民族复兴具有指导意义",
        "它只是一个口号，没有实际意义",
        "它只涉及经济领域，与其他领域无关",
        "它标志着对改革方向的完全放弃"
      ]
    }
  ],
  "requirement": [
    "答案：A",
    "标志对社会主义建设规律和改革开放规律认识的深化",
    "为统筹推进各领域改革提供'管总'的目标",
    "对全面建成小康社会、建设社会主义现代化国家、实现民族复兴具有指导意义"
  ],
  "revision": 2,
  "schema_version": "1.0",
  "status": "draft",
  "test_id": "test_980",
  "title": "单选题",
  "updated_at": "2026-08-15T16:18:49Z"
}
