{
  "item": [
    {
      "type": "judge",
      "question": "判断下列说法是否正确：发扬钉钉子精神，就是主张干事业时速度越快越好、以蛮力猛砸，尽快一劳永逸地完成目标。",
      "options": []
    }
  ],
  "requirement": [
    "答案：错误",
    "钉钉子精神强调的是持久发力、坚定不移，一锤一锤接着敲、久久为功，而非蛮力求快",
    "它要求一张好的蓝图一干到底、善作善成，反对急于求成、一劳永逸的思维",
    "发扬钉钉子精神重在抓铁有痕、踏石留印，把工作落到实处、干到末端"
  ],
  "revision": 2,
  "schema_version": "1.0",
  "status": "draft",
  "test_id": "test_1650",
  "title": "判断题",
  "updated_at": "2026-08-15T16:18:49Z"
}
