{
  "item": [
    {
      "type": "single",
      "question": "关于实现从“治病”到“防病”的观念转变、强化预防为主，下列做法不属于其组成部分的是",
      "options": [
        "深入开展健康中国行动和爱国卫生运动",
        "倡导文明健康的生活方式",
        "改革完善疾病预防控制体系、构建强大公共卫生体系、加强监测预警",
        "把工作重心全部放在事后救治疑难重症，忽视疾病预防"
      ]
    }
  ],
  "requirement": [
    "答案：D",
    "深入开展健康中国行动和爱国卫生运动",
    "倡导文明健康生活方式",
    "改革完善疾病预防控制体系，构建强大公共卫生体系、加强监测预警，把健康理念从“治病”转向“防病”"
  ],
  "revision": 2,
  "schema_version": "1.0",
  "status": "draft",
  "test_id": "test_1311",
  "title": "单选题",
  "updated_at": "2026-08-15T16:18:49Z"
}
