{
  "schema_version": "1.0",
  "revision": 2,
  "status": "published",
  "updated_at": "2026-08-18T16:20:39Z",
  "test_id": "test_1680",
  "title": "辨析判断：关于网络空间治理的说法判断正误。",
  "item": [
    {
      "type": "judge",
      "question": "判断下列说法是否正确，并简述理由：A.“网络空间是法外之地，网民可以自由发表任何言论”。B.“网络舆论一律压制才能实现风清气正”。C.“做优做强网上正面宣传有利于营造清朗网络生态”。D.“任何言论只要内容积极都可以不受法律约束”。",
      "options": []
    }
  ],
  "requirement": [
    "答案：A错误、B错误、C正确、D错误。",
    "A错误：指出网络空间不是法外之地、须受法律约束（2分）；B错误：指出治理应依法依规、防治结合，尊重网民合法权益而非一味压制（3分）；C正确：说明做优做强网上正面宣传对营造清朗网络生态的积极作用（3分）；D错误：说明积极内容也须在法律框架内、坚持依法治理（2分）。各判断独立计分，论述较完整可酌情给分。",
    "总评要点：营造风清气正的网络空间，既要依法管网依法治网，也要做强正面宣传、引导网上舆论，网民依法享有言论自由并承担相应法定义务。"
  ]
}
