{
  "item": [
    {
      "type": "single",
      "question": "关于到2035年基本实现社会主义现代化的主要目标，下列说法正确的是",
      "options": [
        "经济实力、科技实力、综合国力大幅跃升，人均GDP达到中等发达国家水平，进入创新型国家前列",
        "只需把经济总量做大即可，无需推进创新和民生改善",
        "基本实现现代化的目标主要表现在国防军事实力上",
        "到2035年共同富裕没有任何明确要求"
      ]
    }
  ],
  "requirement": [
    "答案：A",
    "经济实力、科技实力、综合国力大幅跃升，人均GDP达到中等发达国家水平、进入创新型国家前列",
    "基本实现新型工业化、信息化、城镇化、农业现代化，建成现代化经济体系、形成新发展格局",
    "建成教育、科技、人才强国，基本建成法治国家，共同富裕取得实质性进展，美丽中国基本实现，基本实现国防和军队现代化、国家安全体系全面加强"
  ],
  "revision": 2,
  "schema_version": "1.0",
  "status": "draft",
  "test_id": "test_850",
  "title": "单选题",
  "updated_at": "2026-08-15T16:18:49Z"
}
