{
  "item": [
    {
      "type": "judge",
      "question": "判断下列说法是否正确：全面从严治党已经取得历史性成就，说明这项工作已基本结束、可以松口气了。",
      "options": []
    }
  ],
  "requirement": [
    "答案：错误",
    "全面从严治党取得的成就来之不易，但党风廉政建设和反腐败斗争远未到大功告成的时候",
    "党内存在的政治不纯、思想不纯、组织不纯、作风不纯等突出问题具有长期性、复杂性、严峻性",
    "全面从严治党永远在路上，是长期战略、永恒课题，必须持之以恒推进"
  ],
  "revision": 2,
  "schema_version": "1.0",
  "status": "draft",
  "test_id": "test_1564",
  "title": "判断题",
  "updated_at": "2026-08-15T16:18:49Z"
}
