{
  "item": [
    {
      "type": "single",
      "question": "结合‘世界百年未有之大变局加速演进’的背景，关于我国提出‘统筹发展和安全’‘构建新发展格局’等举措的现实针对性，下列说法正确的是",
      "options": [
        "这些举措与变局无关，纯属临时口号",
        "这些举措是针对大变局中的风险挑战，统筹应对不确定性、防范风险，并通过国内国际双循环、以国内大循环为主体把握发展主动权的战略安排",
        "构建新发展格局等于闭关锁国、放弃对外开放",
        "统筹发展和安全只是权宜之计，无需长期坚持"
      ]
    }
  ],
  "requirement": [
    "答案：B",
    "变局中的风险挑战（如保护主义抬头、经济全球化受挫）使应对不确定性成为迫切需要",
    "‘统筹发展和安全’是针对大变局中安全风险上升、以发展保障安全的需要",
    "‘构建新发展格局’强调国内国际双循环、以国内大循环为主体，是宏观背景转化为具体战略的体现"
  ],
  "revision": 2,
  "schema_version": "1.0",
  "status": "draft",
  "test_id": "test_775",
  "title": "单选题",
  "updated_at": "2026-08-15T16:18:49Z"
}
