{
  "item": [
    {
      "type": "single",
      "question": "完善社会治理体系，需要健全相应的制度机制。其中，为解决矛盾纠纷、防范化解风险，应构建的机制是",
      "options": [
        "源头防控、排查梳理、纠纷化解、应急处置的矛盾纠纷综合治理机制",
        "只需加大行政处罚力度的单一管控机制",
        "只依赖司法诉讼解决一切纠纷的机制",
        "仅靠网络舆情监测的预警机制"
      ]
    }
  ],
  "requirement": [
    "答案：A",
    "要构建源头防控、排查梳理、纠纷化解、应急处置的矛盾纠纷综合治理机制",
    "健全公共安全体系，编织全方位立体化公共安全网",
    "完善社会治安综合治理，建设立体化信息化社会治安防控体系，健全社会心理服务疏导和危机干预机制"
  ],
  "revision": 2,
  "schema_version": "1.0",
  "status": "draft",
  "test_id": "test_1319",
  "title": "单选题",
  "updated_at": "2026-08-15T16:18:49Z"
}
