{
  "item": [
    {
      "type": "single",
      "question": "我国协商民主要统筹推进的协商类型，包含内容最全面的是",
      "options": [
        "政党协商、人大协商、政府协商、政协协商，以及人民团体协商、基层协商、社会组织协商",
        "只有政党协商和基层协商两种",
        "只包括政府与企业之间的经济协商",
        "只包括国际之间的外事协商"
      ]
    }
  ],
  "requirement": [
    "答案：A",
    "统筹推进政党协商、人大协商、政府协商、政协协商",
    "补充人民团体协商、基层协商、社会组织协商",
    "推进协商民主广泛、多层、制度化发展"
  ],
  "revision": 2,
  "schema_version": "1.0",
  "status": "draft",
  "test_id": "test_1161",
  "title": "单选题",
  "updated_at": "2026-08-15T16:18:49Z"
}
