{
  "item": [
    {
      "type": "single",
      "question": "为什么说增进民生福祉是社会主义生产的根本目的？下列说法不能作为依据的是",
      "options": [
        "在资本主义社会中，生产以资本增殖为目的，劳动者只是手段，人本身不是生产的目的",
        "社会主义区别于其他制度的关键在于消灭了一切社会矛盾",
        "社会主义是人民当家作主的社会，生产要服务于人的发展",
        "要让人民共享各方面发展成果、促进人的全面发展"
      ]
    }
  ],
  "requirement": [
    "答案：B",
    "选项A正确：在资本主义社会中生产以资本增殖（剩余价值）为目的，劳动者只是实现这一目的的手段，人本身不是生产的目的，这正反衬出社会主义生产以增进人民福祉为根本目的的正当性",
    "选项B错误且符合题意：社会主义社会仍然存在社会矛盾，把“消灭了一切社会矛盾”作为社会主义区别于其他制度的关键是不正确的，因此不能作为“增进民生福祉是社会主义生产根本目的”的依据",
    "选项C正确：社会主义是人民当家作主的社会，生产的目的在于增进人民福祉",
    "选项D正确：要让人民共享各方面发展成果、促进人的全面发展，故说增进民生福祉是社会主义生产的根本目的"
  ],
  "revision": 3,
  "schema_version": "1.0",
  "status": "draft",
  "test_id": "test_1280",
  "title": "单选题",
  "updated_at": "2026-08-18T16:20:39Z"
}
