{
  "item": [
    {
      "type": "single",
      "question": "关于教育的根本问题，下列说法正确的是",
      "options": [
        "教育的根本问题就是如何提高升学率，育人方向服从于分数成绩",
        "教育的根本问题是培养什么人、怎样培养人、为谁培养人",
        "教育的根本问题是统筹好各门课程教学内容的多寡",
        "教育的根本问题主要在于能否训练出高水平应试能力"
      ]
    }
  ],
  "requirement": [
    "答案：B",
    "培养什么人、怎样培养人、为谁培养人是教育的根本问题，也是建设教育强国的核心课题",
    "三者环环相扣、统一于立德树人，共同回答教育的方向和使命"
  ],
  "revision": 3,
  "schema_version": "1.0",
  "status": "draft",
  "test_id": "test_1090",
  "title": "单选题",
  "updated_at": "2026-08-18T16:20:39Z"
}
