{
  "item": [
    {
      "type": "single",
      "question": "关于坚持学思用贯通、知信行统一在思想建设中的具体要求，下列说法正确的是",
      "options": [
        "学懂弄通即可，不必强调做实躬身实践；",
        "在结合实际创造性贯彻落实上下功夫、使科学理论转化为推动工作的强大力量即可，不必学懂弄通；",
        "在学懂弄通做实上下功夫、结合实际创造性贯彻落实、使理论转化为指导实践推动工作的强大力量，并体现到各领域各方面；",
        "学习成果只需体现在理论学习笔记上，无须落实到高质量发展等实际成效上"
      ]
    }
  ],
  "requirement": [
    "答案：C",
    "坚持学思用贯通、知信行统一，要在学懂弄通做实上下功夫，在结合实际创造性贯彻落实上下功夫",
    "使科学理论转化为指导实践、推动工作的强大力量",
    "把学习成果体现到推动高质量发展、增进民生福祉、提高斗争本领、营造清风正气等各方面，A、B、D均割裂或阉割了要求"
  ],
  "revision": 2,
  "schema_version": "1.0",
  "status": "draft",
  "test_id": "test_1576",
  "title": "单选题",
  "updated_at": "2026-08-15T16:18:49Z"
}
