{
  "item": [
    {
      "type": "single",
      "question": "关于深化国家监察体制改革的定位与意义，下列说法正确的是",
      "options": [
        "监察委员会是党统一领导的专门反腐败工作机构，与纪委合署办公，实现党内监督与国家监察、依规治党与依法治国有机统一",
        "监察委员会是行政机关下属的普通执法部门，与党的领导无关",
        "深化监察体制改革只是为了合并机构、精简人员",
        "监察委员会只负责查处普通违纪行为，不参与国家反腐败体系"
      ]
    }
  ],
  "requirement": [
    "答案：A",
    "组建党统一领导的专门反腐败工作机构——监察委员会，并与纪委合署办公",
    "实现党内监督与国家监察、依规治党与依法治国有机统一",
    "优化反腐败资源配置，构建统一领导、全面覆盖、权威高效的监督体系"
  ],
  "revision": 3,
  "schema_version": "1.0",
  "status": "draft",
  "test_id": "test_1601",
  "title": "单选题",
  "updated_at": "2026-08-18T16:20:39Z"
}
