{
  "item": [
    {
      "type": "single",
      "question": "关于创新军事战略指导及其整体运筹，下列说法错误的是",
      "options": [
        "军事战略科学准确就是最大的胜算",
        "要把所有军事行动与和平时期军队全部功能割裂开来看待",
        "要打造战略威慑力量体系、增加新域新质作战力量、构建联合作战指挥体系",
        "要把握信息化战争特点、创新发展人民战争战略战术"
      ]
    }
  ],
  "requirement": [
    "答案：B",
    "军事战略科学准确就是最大的胜算",
    "要把备战与止战、威慑与实战、战争行动与和平时期军事力量运用整体运筹",
    "打造战略威慑力量体系、增加新域新质作战力量、构建联合作战指挥体系",
    "把握信息化战争特点、创新发展人民战争战略战术"
  ],
  "revision": 2,
  "schema_version": "1.0",
  "status": "draft",
  "test_id": "test_1454",
  "title": "单选题",
  "updated_at": "2026-08-15T16:18:49Z"
}
