{
  "item": [
    {
      "type": "single",
      "question": "材料指出总体方略\"科学回答了在民族复兴伟大进程中实现祖国完全统一的时代命题\"。关于总体方略的理论价值与实践指导意义，下列说法正确的是",
      "options": [
        "它是国家统一理论的最新成果，标志着国家统一理论更加成熟，是新时代新征程推进祖国统一大业的科学指南和行动纲领，必须长期坚持、全面贯彻",
        "它只是权宜之计，无需长期坚持",
        "它与国家统一理论无关",
        "它对推进祖国统一没有实践指导作用"
      ]
    }
  ],
  "requirement": [
    "答案：A",
    "它是国家统一理论的最新成果，标志着国家统一理论更加成熟",
    "它是新时代新征程推进祖国统一大业的科学指南和行动纲领",
    "必须长期坚持、全面贯彻，为推进祖国统一指明方向"
  ],
  "revision": 2,
  "schema_version": "1.0",
  "status": "draft",
  "test_id": "test_1492",
  "title": "单选题",
  "updated_at": "2026-08-15T16:18:49Z"
}
