{
  "item": [
    {
      "type": "single",
      "question": "关于‘两个确立’的内涵及其确立的依据，下列说法正确的是",
      "options": [
        "‘两个确立’只确立一个领导核心，与理论指导无关",
        "‘两个确立’指确立习近平同志党中央的核心、全党的核心地位，确立习近平新时代中国特色社会主义思想的指导地位，它建立在坚强的领导核心和科学的理论指导这一关乎党和国家前途命运的根本问题之上，反映了全党全军全国各族人民的共同心愿",
        "‘两个确立’只是形式上的文件表述，无实质意义",
        "领导核心与理论指导都不是决定事业成败的根本问题"
      ]
    }
  ],
  "requirement": [
    "答案：B",
    "‘两个确立’即确立习近平同志党中央的核心、全党的核心地位和习近平新时代中国特色社会主义思想的指导地位",
    "坚强的领导核心和科学的理论指导是关乎党和国家前途命运、事业成败的根本性问题",
    "‘两个确立’反映了全党全军全国各族人民的共同心愿，是新时代最重要的政治成果"
  ],
  "revision": 2,
  "schema_version": "1.0",
  "status": "draft",
  "test_id": "test_793",
  "title": "单选题",
  "updated_at": "2026-08-15T16:18:49Z"
}
