{
  "item": [
    {
      "type": "single",
      "question": "关于要整体把握科学体系、避免碎片化理解应坚持的学习方法，下列说法正确的是",
      "options": [
        "只背若干标语口号即可",
        "坚持读原著、学原文、悟原理，把学习同马克思主义基本原理及‘五史’贯通起来，并放在整个科学体系中把握，做到知其然更知其所以然",
        "只要掌握个别观点就算学懂",
        "学习方法随意，无任何要求"
      ]
    }
  ],
  "requirement": [
    "答案：B",
    "坚持读原著、学原文、悟原理，把握思想真谛",
    "把学习同马克思主义基本原理及学习‘五史’贯通起来，在整体中理解具体",
    "放在整个科学体系中把握，做到知其然更知其所以然，避免碎片化理解"
  ],
  "revision": 2,
  "schema_version": "1.0",
  "status": "draft",
  "test_id": "test_800",
  "title": "单选题",
  "updated_at": "2026-08-15T16:18:49Z"
}
